isin,symbol,name
LU1525418726,UBBB.MI,Amundi Index Solutions - Amundi Global Corporate Bond 1-5Y ESG - UCITS ETF DR (C)
LU2439113387,9E0E.DE,Amundi Index Solutions - Amundi Euro Aggregate Bond ESG UCITS ETF DR - EUR (D)
IE00BD4TY345,AUAD.L,UBS MSCI Australia UCITS ETF AUD dis
LU0328474803,DX2S.DE,Xtrackers S&P ASX 200 UCITS ETF
LU2206597804,UIW1.DE,UBS MSCI Europe Socially Responsible UCITS ETF EUR acc
LU0292097317,XMCX.DE,Xtrackers FTSE 250 UCITS ETF 1D
IE00B60SWV01,S250.L,Invesco FTSE 250 UCITS ETF
IE00BP46NG52,ZPR5.DE,State Street SPDR ICE BofA 0-5 Year EM USD Government Bond UCITS ETF
DE000PS7WT17,BNQB.DE,BNP Paribas Issuance B.V.     O
IE000B8VAQZ8,FGHU.SW,Fidelity Global HY Corp Bond Research Enhanced PAB UCITS ETF Inc USD Hedged
DE000PZ9REM3,0GZD.DE,BNP Paribas Issuance B.V.     O
IE00B8FHGS14,IQQ0.DE,iShares Edge MSCI World Minimum Volatility UCITS ETF USD (Acc)
IE00B02KXM00,IQQS.DE,iShares EURO STOXX Small UCITS ETF EUR (Dist)
LU1563454310,KLMT.DE,Amundi Global Aggregate Green Bond UCITS ETF
IE00B428Z604,IS0P.DE,iShares Spain Govt Bond UCITS ETF EUR (Dist)
IE00BFWFPY67,SPFA.DE,State Street SPDR Bloomberg Emerging Markets Local Bond UCITS ETF (Acc)
IE000IZO7033,CBUP.DE,iShares € Green Bond UCITS ETF
JE00B7305Z55,EBRT.MI,WisdomTree Brent Crude Oil - EUR Daily Hedged
IE00BMCZLJ20,UEEH.DE,iShares Edge MSCI World Minimum Volatility UCITS ETF USD (Dist)
IE000Y6L6LE6,XNZE.DE,Xtrackers EMU Net Zero Pathway Paris Aligned UCITS ETF 1C EUR Acc
LU2533812728,BJLD.DE,BNP Paribas Easy € Aggregate Bond SRI Fossil Free UCITS ETF Distribution
IE00BFMXVQ44,VMIG.DE,Vanguard FTSE 250 UCITS ETF GBP Accumulation
IE00B5377D42,IBC6.DE,iShares MSCI Australia UCITS ETF USD (Acc)
IE00BNGFMY78,FEPX.DE,Fidelity Pacific ex-Japan Equity Research Enhanced UCITS ETF USD Acc
LU1230561679,FRCJ.DE,UBS MSCI Japan Socially Responsible UCITS ETF JPY dis
IE00BNDS1T77,V3GS.L,Vanguard Funds PLC - Vanguard ESG Global Corporate Bond UCITS ETF GBP Hedged Acc
IE000CR3ZDF9,CBU2.DE,iShares € Aggregate Bond ESG SRI UCITS ETF EUR (Acc)
LU1681041205,AGEB.MI,Amundi Index Solutions - Amundi USD Emerging Markets Government Bond UCITS ETF Acc
IE000YZIVX22,FLCV.DE,Franklin Emerging Markets Sovereign Debt Values UCITS ETF
IE00BNDS1V99,V3GP.L,Vanguard Funds PLC - Vanguard ESG Global Corporate Bond UCITS ETF GBP Hedged Inc
IE00BYMS5W68,KFTK.DE,Invesco KBW NASDAQ Fintech UCITS ETF
IE00BZ0RTB90,UKSRT.SW,UBS MSCI United Kingdom IMI Socially Responsible UCITS ETF hCHF dis
LU2206598109,UIW3.DE,UBS MSCI Europe Socially Responsible UCITS ETF hEUR acc
DE000PB8R1M6,BNQV.DE,BNP Paribas Issuance B.V.     O
JE00B2NFTD12,LCFE.L,WisdomTree Coffee 2x Daily Leveraged
IE00B4613386,SYBM.DE,State Street SPDR Bloomberg Emerging Markets Local Bond UCITS ETF (Dist)
IE00B1TXHL60,IQQL.DE,iShares Listed Private Equity UCITS ETF USD (Dist)
IE00BQN1K562,CEMQ.DE,iShares Edge MSCI Europe Quality Factor UCITS ETF EUR (Acc)
LU0322252338,DXS6.DE,Xtrackers MSCI Pacific ex Japan Screened UCITS ETF 1C
IE00BYZK4883,2B79.DE,iShares Digitalisation UCITS ETF
DE000A0H0785,EXHF.DE,iShares Euro Government Bond Capped 1.5-10.5yr UCITS ETF (DE)
IE00B3VWLG82,SXRD.DE,iShares VII PLC - iShares MSCI UK Small Cap ETF GBP Acc
GB00B15KXN58,ALUM.L,WisdomTree Aluminium
IE00BLRPRF81,EMAB.DE,L&G Emerging Markets Corporate Bond (USD) Screened UCITS ETF USD Distributing
IE000D8FCSD8,CBUW.DE,iShares Listed Private Equity UCITS ETF USD (Acc)
DE000A1EK0H1,XAD3.DE,DB ETC PLC                    E
IE0007EH5UK6,EMHC.SW,L&G Emerging Markets Corporate Bond (USD) Screened UCITS ETF CHF Hedged Accumulating
DE000PR5RMU7,B4NM.DE,BNP Paribas Issuance B.V.     O
IE00BK5BZQ82,3AN.DE,Leverage Shares 3x Amazon ETC
IE00B2QWCY14,IUS3.DE,iShares S&P SmallCap 600 UCITS ETF USD (Dist)
IE00BYPLS672,USPY.DE,L&G Cyber Security UCITS ETF
IE0008ZGI5C1,FLPE.DE,Northern Trust Listed Private Equity UCITS ETF
DE000ETFL144,EL4N.DE,Deka iBoxx EUR Liquid Sovereign Diversified 5-7 UCITS ETF
IE00BG13YG34,IEQD.L,iShares Edge MSCI Europe Quality Factor UCITS ETF EUR (Dist)
CH1135202161,H21V.DE,21Shares AG                   O
DE000A2UDH63,XPPE.DE,XTrackers ETC PLC             E
CH0475552201,ABCH.DE,21Shares AG                   O
IE00B0M63284,IQQP.DE,iShares European Property Yield UCITS ETF EUR (Dist)
IE00B00FV128,MIDD.SW,iShares FTSE 250 UCITS ETF
DE000ETF9603,E960.DE,Amundi STOXX Europe 600 ESG II UCITS ETF
FR0010821819,540H.DE,Amundi MSCI Europe Ex EMU ESG Selection UCITS ETF Acc
LU1563454823,KLMH.DE,Amundi Global Aggregate Green Bond UCITS ETF
LU1291103338,EKLD.DE,BNP Paribas Easy MSCI USA SRI S-Series PAB 5% Capped
IE00BMDBMN04,GRON.DE,iShares € Green Bond UCITS ETF
IE00BF2FNL98,T3GB.L,Invesco US Treasury Bond 1-3 Year UCITS ETF GBP Hdg Dist
LU2023678449,GENY.DE,Amundi MSCI Millennials UCITS ETF Acc
LU1407887675,LYUS13.SW,Amundi US Treasury Bond 1-3Y UCITS ETF GBP Hedged Dist
IE00BK63RN45,MKUW.L,Invesco Markets Plc - Invesco MSCI Kuwait UCITS ETF USD Acc
IE0006FDYJF8,XCJD.DE,Xtrackers MSCI Japan Climate Transition UCITS ETF 1D USD
IE000BKMMHF9,BCFB.DE,UBS MSCI Pacific ex Japan IMI Socially Responsible UCITS ETF USD acc
IE00B7SD4R47,3EUL.MI,WisdomTree EURO STOXX 50 3x Daily Leveraged
LU1681046774,KX1G.DE,Amundi Index Solutions - Amundi Euro Lowest Rated IG Government Bond UCITS ETF-C
IE00BM9GRN41,FSMP.L,Fidelity Global Corp Bond Research Enhanced PAB UCITS ETF GBP Accumulation Hedged
IE00BGDQ0L74,IPRE.DE,iShares European Property Yield UCITS ETF EUR (Acc)
IE0000U24AJ9,USRIH.MI,Amundi MSCI USA SRI Climate Paris Aligned UCITS ETF Acc EUR HEDGED
LU1603797587,IQJP.MI,IndexIQ Factors Sustainable Japan Equity UCITS ETF Cap
LU1900067601,LTUR.DE,Amundi MSCI Turkey UCITS ETF Acc
LU1681046857,X1GD.DE,Amundi Index Solutions - Amundi Euro Lowest Rated IG Government Bond UCITS ETF-D
IE000Z9UVQ99,BATF.DE,L&G Asia Pacific ex Japan ESG Paris Aligned UCITS ETF
LU1686830909,LYQS.DE,Amundi Index Solutions - Amundi USD Emerging Markets Government Bond UCITS ETF Dist
LU1910940425,B8TQ.DE,Amundi Global Government Inflation-Linked Bond 1-10Y UCITS ETF
CH1135202179,21HX.DE,21Shares Crypto Basket 10 Core ETP
IE000K9Z3SF5,C3AE.DE,Invesco Markets plc - Invesco S&P China A 300 Swap UCITS ETF
DE000A0H08P6,EXH8.DE,iShares STOXX Europe 600 Retail UCITS ETF (DE)
IE00BL0L0D23,FTCS.L,First Trust Capital Strength UCITS ETF Class A USD Accumulation
IE000Y6ZXZ48,XG12.DE,Xtrackers MSCI Global Circular Economy UCITS ETF 1C
IE00BD5HBQ97,FTFX.L,First Trust FactorFX UCITS ETF Class A USD
IE00B1FZS467,IQQI.DE,iShares Global Infrastructure UCITS ETF USD (Dist)
IE00BKLF1R75,W1TA.DE,WisdomTree Battery Solutions UCITS ETF - USD Acc
LU1686831030,EMBHI.MI,Amundi Index Solutions - Amundi USD Emerging Markets Government Bond UCITS ETF EUR Hedged Dist
IE00BX7RQY03,UBUR.DE,UBS Factor MSCI USA Low Volatility UCITS ETF USD dis
JE00B2NFTS64,LSIL.MI,WisdomTree Silver 2x Daily Leveraged
GB00B15KXV33,CRUD.L,WisdomTree WTI Crude Oil
LU0322252171,XAXJ.DE,Xtrackers MSCI AC Asia ex Japan ESG Swap UCITS ETF 1C
IE00BH3YZ803,SMLK.DE,Invesco S&P SmallCap 600 UCITS ETF
IE0007G78AC4,ASIG.AS,iShares $ Asia Investment Grade Corp Bond UCITS ETF USD (Acc)
IE00BJ5JP212,36BB.DE,iShares MSCI World Consumer Discretionary Sector Advanced UCITS ETF USD Inc
IE00BYTRRH56,WUTI.MI,State Street SPDR MSCI World Utilities UCITS ETF USD Acc
LU1459801947,UBTP.L,UBS Core BBG TIPS 1-10 UCITS ETF hGBPacc
LU2469335884,AHYC.DE,Amundi Index Solutions - Amundi EUR Corporate Bond ESG UCITS ETF DR - Hedged USD (C)
IE00BLB2GQ94,MACU.AS,iShares Conservative Portfolio UCITS ETF USD Hedged (Acc)
LU1681040900,FRNU.DE,Amundi Index Solutions - Amundi Floating Rate USD Corporate ESG - UCITS ETF DR - USD (C)
LU1377382368,LCEU.DE,BNP Paribas Easy Low Carbon 100 Europe PAB
IE00B4LHWP62,SPLT.MI,iShares Physical Platinum ETC
LU0292109856,DBX9.DE,Xtrackers MSCI China A UCITS ETF 1C
CH1184151731,HDX1.DE,Hashdex Nasdaq CME Crypto Index ETP
IE00BMDBMK72,APJX.DE,iShares MSCI Pacific ex-Japan CTB Enhanced ESG UCITS ETF USD Acc
LU1659681586,ZSRM.DE,BNP Paribas Easy MSCI USA SRI PAB UCITS ETF EUR Capitalisation
LU1659681669,EKUS.DE,BNP Paribas Easy MSCI USA SRI PAB UCITS ETF EUR Distribution
CH0496484640,21XA.DE,21Shares Bitcoin Ethereum Core ETP
LU1981860668,XCO2C.SW,Amundi Global Aggregate Proceeds Bond 1-10Y UCITS ETF CHF Hedged Acc
DE000PZ9REB6,B4NY.DE,BNP Paribas Issuance B.V.     O
IE00BWBXM492,ZPDE.DE,State Street SPDR S&P U.S. Energy Select Sector UCITS ETF
XS2425848053,WENT.MI,WisdomTree Energy Transition Metals ETC
LU0322250712,DX2D.DE,Xtrackers LPX Private Equity Swap UCITS ETF
IE00BWTN6Y99,HDLV.DE,Invesco S&P 500 High Dividend Low Volatility UCITS ETF
IE00B435CG94,XLES.MI,Invesco Energy S&P US Select Sector UCITS ETF
IE00BKFB6K94,CNUA.DE,UBS MSCI China A SF UCITS ETF USD acc
IE000XLJ2JQ9,MWON.DE,Amundi S&P SmallCap 600 Screened UCITS ETF DIST
IE00BCHWNS19,XUEN.DE,Xtrackers MSCI USA Energy UCITS ETF 1D
IE00B40QP990,8PSA.DE,Invesco Physical Markets PLC  O
DE000A2QP398,STEC.AS,iShares STOXX Europe 600 Technology UCITS ETF (DE) EUR acc
IE00BWT3KJ20,UBUV.DE,UBS Factor MSCI USA Low Volatility UCITS ETF hEUR acc
IE00BMYHQM42,GOVA.MI,State Street SPDR Bloomberg Euro Government Bond UCITS ETF EUR Acc
IE00BQ70R696,NBTK.DE,Invesco NASDAQ Biotech UCITS ETF
LU1437018838,EPRA.MI,Amundi Index Solutions - Amundi FTSE EPRA NAREIT Global UCITS ETF DR
IE000R85HL30,WEBD.DE,Amundi MSCI USA SRI Climate Paris Aligned UCITS ETF Acc
IE00BG5QQ390,IU0E.DE,iShares $ Corp Bond 0-3yr ESG SRI UCITS ETF EUR Hedged (Acc)
IE00BGYWFN19,VGPA.L,Vanguard USD Corporate Bond UCITS ETF GBP Hedged Accumulation
LU1737652823,10AJ.DE,Amundi Index Solutions - Amundi FTSE EPRA NAREIT Global UCITS ETF DR (D)EUR
IE00BKWQ0N82,SPYT.DE,State Street SPDR MSCI Europe Communication Services UCITS ETF
FR0014002IH8,MBTC.DE,Mélanion BTC Equities Universe UCITS ETF EUR
IE00B8JG1787,3SIS.MI,WisdomTree Silver 3x Daily Short
LU0779800910,XCHA.DE,Xtrackers CSI300 Swap UCITS ETF 1C
IE00B42NKQ00,QDVF.DE,iShares S&P 500 Energy Sector UCITS ETF USD (Acc)
IE00BYXG2H39,2B70.DE,iShares Nasdaq US Biotechnology UCITS ETF USD (Acc)
IE00B0M62V02,IQQG.DE,iShares Euro Total Market Growth Large UCITS ETF EUR (Dist)
IE00BDZVHG35,BTEE.L,iShares Nasdaq US Biotechnology UCITS ETF USD (Dist)
IE00BP8FKB21,XREA.DE,Xtrackers FTSE Developed Europe ex UK Real Estate UCITS ETF 1C
LU0292104030,DXSG.DE,Xtrackers MSCI Europe Communication Services Screened UCITS ETF 1C
IE00BLCHJT74,SN5R.DE,Global X Internet of Things UCITS ETF USD Acc
IE00BFMM9235,ITEH.L,iShares Italy Govt Bond UCITS ETF USD Hedged (Acc)
FR0010869578,LYQK.DE,Amundi German Bund Daily (-2x) Inverse UCITS ETF
IE00BF540Y54,AGBP.L,iShares Core Global Aggregate Bond UCITS ETF GBP Hedged (Dist)
IE00BLPK3577,W1TB.DE,WisdomTree Cybersecurity UCITS ETF USD Acc
LU2182388152,PRUK.L,Amundi Index Solutions - Amundi Prime UK Mid and Small Cap ETF DR D
IE00BSJCQV56,ZPRP.DE,State Street SPDR FTSE EPRA Europe ex UK Real Estate UCITS ETF
IE00BF1QPJ56,SPFB.DE,State Street SPDR Bloomberg Global Aggregate Bond UCITS ETF GBP Hedged
IE00BKVL7331,MVEA.DE,iShares Edge MSCI USA Minimum Volatility Advanced UCITS ETF USD (Acc)
LU2469465822,XCNA.DE,Xtrackers MSCI China A Screened Swap UCITS ETF 1C USD Acc
LU0950381748,EEAA.DE,BNP Paribas Easy FTSE EPRA/NAREIT Eurozone Capped UCITS ETF Cap
JE00B2QXZK10,COCO.L,WisdomTree Cocoa
CH0475986318,KEYS.SW,21Shares Bitwise Select 10 Large Cap Crypto Index ETP
LU1310477036,AH50.DE,Xtrackers Harvest CSI A500 UCITS ETF
IE00BDFGJ627,FLOA.L,iShares $ Floating Rate Bond UCITS ETF USD (Acc)
IE00B5L01S80,H4ZL.DE,HSBC FTSE EPRA NAREIT Developed UCITS ETF
IE000G6GSP88,H4Z7.DE,HSBC FTSE EPRA NAREIT Developed UCITS ETF
LU2572256746,C024.DE,Amundi Index Solutions - Amundi Core MSCI China A Swap UCITS ETF Dist
IE00B6R51Z18,IS0D.DE,iShares Oil & Gas Exploration & Production UCITS ETF USD (Acc)
IE00BZ048462,QDVY.DE,iShares $ Floating Rate Bond UCITS ETF USD (Dist)
LU1291101555,EESM.DE,BNP Paribas Easy MSCI Europe Small Caps SRI PAB UCITS ETF Capitalisation
DE000ETFL110,EL4K.DE,Deka iBoxx EUR Liquid Sovereign Diversified 1-10 UCITS ETF
IE00B1FZS574,IQQ5.DE,iShares MSCI Turkey UCITS ETF USD (Dist)
IE00BJXRZJ40,RCRS.DE,Rize UCITS ICAV - Rize Cybersecurity Data Privacy ETF
LU2182388749,PR1H.DE,Amundi Index Solutions - Amundi US Treasury Bond 0-1Y UCITS ETF EUR Hedged Acc
IE00BLCH1X54,T1EU.DE,Invesco US Treasury Bond 0-1 Year UCITS ETF EUR Hdg Acc
LU1923163759,AFRHU.PA,Amundi Index Solutions - Amundi EUR Floating Rate Corporate Bond ESG - UCITS ETF DR - USD HEDGED (C)
IE00BHZRQZ17,FLXI.DE,Franklin FTSE India UCITS ETF
FR0010524777,LYM9.DE,Amundi MSCI New Energy UCITS ETF Dist
LU2355200523,AGHG.L,Amundi Index Solutions - Amundi Core Global Aggregate Bond UCITS ETF DR GBP Hedged
IE00BWBXM831,ZPDM.DE,State Street SPDR S&P U.S. Materials Select Sector UCITS ETF
IE0005FKEK99,JGNR.DE,JPM Green Social Sustainable Bond Active UCITS ETF - USD Acc
IE00BMDPBY65,FLXP.DE,Franklin STOXX Europe 600 Paris Aligned Climate UCITS ETF
IE00BFMKQ930,XYLE.DE,Xtrackers USD Corporate Bond Short Duration SRI PAB UCITS ETF 2C - EUR Hedged
IE000KDY10O3,W3B3.DE,ETC Group Web 3.0 UCITS ETF
IE00BJ06C481,PUIP.L,Invesco USD IG Corporate Bond ESG Climate Transition UCITS ETF GBP Hedged
IE00B6YX5D40,SPYD.DE,State Street SPDR S&P US Dividend Aristocrats UCITS ETF Dis
LU1048315086,CBUS5AN.MX,UBS ETF - Bloomberg Barclays US Liquid Corporates 1-5 Year UCITS ETF
LU0643975591,X03F.DE,Xtrackers II Eurozone Government Bond UCITS ETF 1D EUR
LU2355200796,GOVG.L,Amundi Index Solutions - Amundi Core Global Government Bond UCITS ETF DR GBP Hedged
IE00B4MKCJ84,2B7B.DE,iShares V PLC - iShares S&P 500 Materials Sector UCITS ETF
LU1681042435,CG9.PA,Amundi Index Solutions - Amundi MSCI Europe Growth UCITS ETF Acc
DE000A0H08Q4,EXV3.DE,iShares STOXX Europe 600 Technology UCITS ETF (DE) EUR dis
LU0192223062,IM2A.DE,BNP Paribas Easy FTSE EPRA/NAREIT Eurozone Capped UCITS ETF QD Dis
IE00BN4Q0X77,AW15.DE,UBS MSCI Japan Climate Paris Aligned UCITS ETF JPY acc
LU1834988518,LTUG.DE,Lyxor Index Fund - Lyxor Stoxx Europe 600 Technology UCITS ETF Acc
LU1048315243,UEF8.DE,UBS BBG US Liquid Corp 1-5 UCITS ETF hEUR acc
LU2365458814,ASRQ.DE,BNP Paribas Easy JPM ESG Green Social & Sustainability IG EUR Bond
IE00099GAJC6,CNYE.DE,Amundi Index Solutions - Amundi China CNY Bonds UCITS ETF DR USD Cap
LU0292100806,DXSC.DE,Xtrackers MSCI Europe Materials Screened UCITS ETF 1C
IE00B3XM3R14,XLBS.MI,Invesco Materials S&P US Select Sector UCITS ETF
LU2082998837,CSTA.DE,Lyxor STOXX Europe 600 Technology UCITS ETF Dis
LU2365458731,ASRN.DE,BNP Paribas Easy JPM ESG Green Social & Sustainability IG EUR Bond
LU1834983634,LCHM.DE,Amundi STOXX Europe 600 Basic Materials UCITS ETF Acc
LU0484969463,XBAT.DE,Xtrackers II Target Maturity Sept 2029 Italy and Spain Government Bond UCITS ETF
DE000PR5RBU0,BNQ7.DE,BNP Paribas Issuance B.V.     O
LU0290355717,XGLE.DE,Xtrackers II Eurozone Government Bond UCITS ETF 1C EUR
IE00BG47K971,VAGS.L,Vanguard Global Aggregate Bond UCITS ETF GBP Hedged Accumulation
GB00B15KXQ89,COPA.L,WisdomTree Copper
LU1287023185,LYXD.DE,Amundi Euro Government Bond 7-10Y UCITS ETF Acc
LU0290357259,X710.DE,Xtrackers II Eurozone Government Bond 7-10 UCITS ETF 1C
LU0476289466,D5BI.DE,Xtrackers MSCI Mexico UCITS ETF 1C
IE00BG47KG48,VAGP.L,Vanguard Global Aggregate Bond UCITS ETF GBP Hedged Income
LU1852212023,MDBG.L,UBS Sustainable Development Bank Bonds UCITS ETF hGBP dis
DE000A3GYNB0,GXRP.DE,Bitwise Physical XRP ETC
IE00074JLU02,XNJP.DE,Xtrackers Japan Net Zero Pathway Paris Aligned UCITS ETF
LU2408468291,AW1M.DE,UBS BBG MSCI US Liquid Corp 1-5 Sustainable UCITS ETF hEUR acc
LU1832418773,LMWE.DE,Amundi FTSE EPRA/NAREIT Global II UCITS ETF D
IE00BH4GR342,SPY2.DE,State Street SPDR Dow Jones Global Real Estate UCITS ETF USD Cap
LU2090062949,MTDD.DE,Amundi Euro Government Bond 7-10Y UCITS ETF Dist
IE0001J5A2T9,REUS.DE,VanEck Circular Economy UCITS ETF A USD Acc
LU2082996542,LYX4.DE,Amundi STOXX Europe 600 Basic Materials UCITS ETF Dist
JE00BPRDNL86,CTEN.PA,CoinShares Physical Top10 Crypto Market ETP
IE00053WDH64,HYDE.DE,Invesco Markets II Plc - Invesco Hydrogen Economy Ucits ETF
IE00BKVKW020,FVD.DE,First Trust Value Line Dividend Index UCITS ETF Class A USD Accumulation
IE000FBG59J1,JGNE.DE,JPM Green Social Sustainable Bond Active UCITS ETF - EUR Hedged (acc)
IE00B4WXJJ64,EUNH.DE,iShares Core € Govt Bond UCITS ETF EUR (Dist)
IE00BH04GL39,VGEA.DE,Vanguard EUR Eurozone Government Bond UCITS ETF EUR Accumulation
IE00B67B7N93,MINT.MI,PIMCO ETFs plc - US Dollar Short Maturity UCITS ETF
LU1248511575,SMARTU.MI,Multi Units Luxembourg - Amundi Smart Overnight Return USD Hedged UCITS ETF Acc
IE00BGYWSV06,VAGY.DE,Vanguard USD Corporate 1-3 Year Bond UCITS ETF USD Accuimulation
IE00BZ163H91,VGEB.DE,Vanguard EUR Eurozone Government Bond UCITS ETF
LU1931975152,PR1R.DE,Amundi Index Solutions - Amundi Prime Euro Government Bond UCITS ETF Dist
LU2089238898,PRAR.DE,Amundi Index Solutions - Amundi Prime Euro Government Bond UCITS ETF Acc
IE00BYV12Y75,SYBR.DE,State Street SPDR Bloomberg 1-10 Year U.S. Corporate Bond UCITS ETF
IE00B3S5XW04,SYBB.DE,State Street SPDR Bloomberg Euro Government Bond UCITS ETF
IE00BZBW4Z27,UIND.L,First Trust US Equity Income UCITS ETF Class A
IE00B8GF1M35,SPYJ.DE,State Street SPDR Dow Jones Global Real Estate UCITS ETF
IE00BDD48R20,VUSC.DE,Vanguard USD Corporate 1-3 year Bond UCITS ETF
IE00B5WHFQ43,CEBG.DE,iShares VII PLC - iShares MSCI Mexico Capped ETF USD Acc
IE000WIQIPT2,CBUL.DE,iShares $ TIPS 0-5 UCITS ETF
LU1598688189,LGWT.DE,Amundi Index Solutions - Amundi MSCI Europe Growth UCITS ETF Dist
IE00BP9F2H18,LDCU.MI,PIMCO Advantage Low Duration US Corporate Bond Source Ucits ETF USD Inc
IE0005QL4147,UEDA.SW,iShares $ Ultrashort Bond ESG SRI UCITS ETF USD Acc
IE00BGJWWW40,EIBX.DE,Invesco Markets II plc - Invesco Euro Government Bond 7-10 Year UCITS ETF EUR Dist
IE000V0GDVU7,XG11.DE,Xtrackers MSCI Global SDG 11 Sustainable Cities UCITS ETF 1C
IE000LJG9WK1,TGGD.L,Janus Henderson GCC Sovereign USD Bond Core UCITS ETF GBP-H Dist
IE00BLDGH553,SECA.DE,iShares € Govt Bond Climate UCITS ETF EUR (Acc)
IE00B7J7TB45,IS0X.DE,iShares Global Corp Bond UCITS ETF USD (Dist)
IE00BGCSB447,ERNA.L,iShares $ Ultrashort Bond UCITS ETF USD (Acc)
LU1437018598,A4HC.DE,Amundi Core Euro Government Bond UCITS ETF Acc
IE00B1FZS806,IBCM.DE,iShares € Govt Bond 7-10yr UCITS ETF EUR (Dist)
IE00B3VTN290,SXRQ.DE,iShares VII PLC - iShares € Govt Bond 7-10yr ETF EUR Acc
IE00BG8BCY43,JPPA.DE,JPMorgan ETFs (Ireland) ICAV - USD Ultra-Short Income Active ETF USD Acc
LU1048314949,UEF7.DE,UBS BBG US Liquid Corp 1-5 UCITS ETF USD dis
DE0006289465,EXHA.DE,iShares eb.rexx Government Germany UCITS ETF (DE)
IE00098ZGGO6,IU0A.SW,Ishares II PLC - Ishares Corp Bond 0-3yr Esg Ucits ETF
IE00BGQYRQ28,XUCS.DE,Xtrackers MSCI USA Consumer Staples UCITS ETF 1D
IE00BLCHJN13,LI7U.DE,Global X Lithium & Battery Tech UCITS ETF
JE00B4PDKD43,ECOP.MI,WisdomTree Copper - EUR Daily Hedged
IE00BLDGH447,SECD.DE,iShares € Govt Bond Climate UCITS ETF EUR (Dist)
LU1737653714,10AL.DE,Amundi Core Euro Government Bond UCITS ETF Dist
IE000H22E3N8,CBU0.DE,iShares Core £ Corp Bond UCITS ETF
IE00BGJWWX56,EIBB.DE,Invesco Euro Government Bond UCITS ETF
IE000UU299V4,HJAP.DE,HSBC MSCI Japan Climate Paris Aligned UCITS ETF
LU0942970368,XBGG.L,Xtrackers II ESG Global Aggregate Bond UCITS ETF 3D - GBP Hedged
GB00B15KY435,SOYO.MI,WisdomTree Soybean Oil
IE00B0M62X26,IBCI.DE,iShares € Inflation Linked Govt Bond UCITS ETF EUR (Acc)
IE00BCRY5Y77,IS3J.DE,iShares $ Short Duration Corp Bond UCITS ETF USD (Dist)
LU1861137484,MIVB.DE,Amundi MSCI Europe SRI Climate Paris Aligned - UCITS ETF DR (C)
IE00BFM6TB42,36B7.DE,iShares Global Corp Bond UCITS ETF
LU0629460832,UIMT.DE,UBS MSCI Pacific Socially Responsible UCITS ETF USD dis
LU0641006290,XGSG.L,Xtrackers II Global Government Bond UCITS ETF 2D - GBP Hedged
LU0290358224,XEIN.DE,Xtrackers II Eurozone Inflation-Linked Bond UCITS ETF 1C
CH0454664043,21XP.DE,21Shares XRP ETP
LU1681041890,AMEQ.DE,Amundi Index Solutions - Amundi MSCI Europe Quality Factor UCITS ETF-C
IE00BFM6T921,DPYA.L,iShares Developed Markets Property Yield UCITS ETF
LU1390062831,UINF.DE,Amundi Euro Inflation Expectations 2-10Y UCITS ETF
DE000ETFL177,EL4R.DE,Deka Deutsche Börse EUROGOV Germany UCITS ETF
LU0950674928,USUP.DE,UBS MSCI Pacific Socially Responsible UCITS ETF USD acc
IE00BC7GZX26,SYBF.DE,State Street SPDR Bloomberg 0-3 Year U.S. Corporate Bond UCITS ETF
IE00BF8J5974,XYLD.DE,Xtrackers USD Corporate Bond Short Duration SRI PAB UCITS ETF 1D
LU2059756598,ACU7.DE,Amundi MSCI Europe SRI Climate Paris Aligned - UCITS ETF DR (D)
IE00BJK9HD13,BBEG.DE,JPMorgan ETFs (Ireland) ICAV BetaBuilders EUR Govt Bond UCITS ETF
IE00BWC52F58,0DB5.L,PIMCO ADVANTAGE US LOW DURATION
IE00BLR6Q544,H3R0.DE,Global X Video Games & Esports UCITS ETF
FR0007052782,CAC.PA,Amundi CAC 40 UCITS ETF Dist
LU1650491282,LYQ7.DE,Amundi Euro Government Inflation-Linked Bond UCITS ETF Acc
IE00B40B8R38,2B7D.DE,iShares V PLC - iShares S&P 500 Consumer Staples Sector UCITS ETF
IE00BNDS1P30,V3GF.DE,Vanguard Funds PLC - Vanguard ESG Global Corporate Bond UCITS ETF EUR Hedged Acc
IE00BNDS1Q47,V3GE.DE,Vanguard Funds PLC - Vanguard ESG Global Corporate Bond UCITS ETF EUR Hedged Inc
IE00BP3QZJ36,IS3U.DE,iShares MSCI France UCITS ETF
CH0445689208,21XH.DE,21Shares AG                   O
LU1048315755,CBUS5S.SW,UBS BBG US Liquid Corp 1-5 UCITS ETF hCHF acc
LU0322250985,DX2G.DE,Xtrackers CAC 40 UCITS ETF
IE00BDFC6Q91,JPPS.DE,JPMorgan ETFs (Ireland) ICAV - USD Ultra-Short Income Active UCITS ETF USD (dist)
IE00B979GK47,SPPD.DE,State Street SPDR S&P US Dividend Aristocrats UCITS ETF EUR Dis
IE00B435BG20,XLPS.MI,Invesco Consumer Staples S&P US Select Sector UCITS ETF
IE00BMDBMG37,CBUD.DE,iShares MSCI Europe SRI UCITS ETF
LU1650491795,E15H.DE,Amundi Euro Government Inflation-Linked Bond UCITS ETF Dist
LU2408467723,U15S.MI,UBS BBG MSCI US Liquid Corp 1-5 Sustainable UCITS ETF USD acc
IE00BJP26C72,UEDD.AS,iShares $ Ultrashort Bond ESG SRI UCITS ETF USD Inc
LU1981860239,XCOU.L,Amundi Global Aggregate Proceeds Bond 1-10Y UCITS ETF USD Hedged Acc
IE00BLR6Q650,H3R0.DE,Global X Video Games & Esports UCITS ETF
DE000PZ9REW2,B4NZ.DE,BNP Paribas Issuance B.V.     O
XS2399369110,2BRE.DE,Leverage Shares PLC           E
IE00BYXYYP94,SDIA.SW,iShares $ Short Duration Corp Bond UCITS ETF USD (Acc)
LU1681046261,CB3G.DE,AMUNDI EURO GOVERNMENT TILTED GREEN BOND UCITS ETF Acc
IE00B52VJ196,IUSK.DE,iShares MSCI Europe SRI UCITS ETF
FR0013380607,CACC.PA,Amundi CAC 40 UCITS ETF Acc
IE00BDQZ5152,SXRF.DE,iShares $ Intermediate Credit Bond UCITS ETF USD (Dist)
IE00BZ048579,SNAV.DE,iShares $ Corp Bond 0-3yr ESG SRI UCITS ETF USD (Dist)
IE00BGDPWW94,36B3.DE,iShares MSCI Europe SRI UCITS ETF
IE00BM9GRM34,FSCM.DE,Fidelity Global Corp Bond Research Enhanced PAB UCITS ETF USD Income
IE00BDZVHD04,DPYE.L,iShares Developed Markets Property Yield UCITS ETF EUR Hedged (Acc)
IE000I8IKC59,PAUJ.DE,IMII-MSCI J.ESG Cl.Par.Al.ETF R
LU2470620845,AHYH.DE,Amundi Index Solutions - Amundi Global Aggregate Bond 1-5Y ESG UCITS ETF DR - Hedged EUR
IE000QOU09J7,FXAC.AS,iShares China Large Cap UCITS ETF USD Acc
LU2408468887,CBSUS5.SW,UBS BBG MSCI US Liquid Corp 1-5 Sustainable UCITS ETF hCHF acc
LU2099991536,4UBP.DE,UBS BBG MSCI Global Liquid Corp Sustainable UCITS ETF USD acc
IE0008SEV3B2,EGVD.DE,Invesco EUR Government and Related Green Bond Weighted UCITS ETF Dis
LU2099991882,CORPS.SW,UBS BBG MSCI Global Liquid Corp Sustainable UCITS ETF hUSD acc
IE00BNDS1W07,V3GU.L,Vanguard Funds PLC - Vanguard ESG Global Corporate Bond UCITS ETF USD Hedged Acc
DE000PB6R1B1,BNQC.DE,BNP Paribas Issuance B.V.     O
IE000LZC9NM0,TAHY.L,Janus Henderson Haitong Asia ex-Japan High Yield Corp USD Bond Screened Core UCITS ETF Acc
LU1481202692,JBEM.DE,BNP Paribas Easy JPM Tilted EMU Government Bond IG UCITS ETF Capitalisation
IE00B9MRHC27,XDN0.DE,Xtrackers MSCI Nordic UCITS ETF 1D
IE000JXFRNI0,TI5A.AS,iShares $ TIPS 0-5 UCITS ETF USD (Acc)
IE00BJXRT698,ZPR1.DE,SSGA SPDR ETFS Europe I PLC - SPDR Bloomberg Barclays 1-3 Month T-Bill UCITS ETF
IE00BF3N6Z78,CRPU.SW,iShares Global Corp Bond UCITS ETF
LU1681047079,C4D.PA,Amundi Index Solutions - AMUNDI CAC 40 ESG UCITS ETF DR - EUR (D)
LU1681046006,WDNR.DE,Amundi Global Bioenergy UCITS ETF EUR Acc
IE00BF2GC043,TR7S.L,Invesco US Treasury Bond 3-7 Year UCITS ETF GBP Hdg Dist
IE00BNDS1X14,V3GD.L,Vanguard Funds PLC - Vanguard ESG Global Corporate Bond UCITS ETF USD Hedged Inc
IE00BKW9SX35,SPLW.MI,Invesco S&P 500 Low Volatility UCITS ETF Accumulation
GB00BMTP1626,MEGA.PA,WisdomTree Physical Crypto Mega Cap Equal Weight
CH0496454155,21XJ.DE,21Shares AG                   O
IE0007BT2BH8,EGVA.DE,Invesco EUR Government and Related Green Bond Weighted UCITS ETF Acc
LU1407889457,US3.SW,Amundi US Treasury Bond 3-7Y UCITS ETF GBP Hedged Dist
LU1681046188,CWEU.PA,Amundi Global Bioenergy UCITS ETF USD Acc
IE000XIITCN5,TAGD.L,Janus Henderson Haitong Asia ex-Japan High Yield Corp USD Bond Screened Core UCITS ETF GBP-H Dist
JE00BDD9Q840,LOIL.MI,WisdomTree WTI Crude Oil 2x Daily Leveraged
JE00B24DKH53,SNGA.L,WisdomTree Natural Gas 1x Daily Short
IE000NFR7C63,CBUK.DE,iShares MSCI China Tech UCITS ETF
GB00B15KYG56,AIGI.L,WisdomTree Industrial Metals
LU1681046931,GC40.DE,Amundi Index Solutions - AMUNDI CAC 40 ESG UCITS ETF DR - EUR (C)
IE00BCRY6227,IS3L.DE,iShares $ Ultrashort Bond UCITS ETF
IE00BNDS1R53,V3GX.SW,Vanguard Funds PLC - Vanguard ESG Global Corporate Bond UCITS ETF CHF Hedged Acc
IE00BMD8KM66,BBM3.L,JPM BetaBuilders US Treasury Bond 0-3 Months UCITS ETF
LU0321465469,XFFE.DE,Xtrackers II USD Overnight Rate Swap UCITS ETF 1C
IE00BKPSFD61,CYBA.AS,iShares China CNY Bond UCITS ETF
IE00BJJYYX67,TFRN.MI,WisdomTree USD Floating Rate Treasury Bond UCITS ETF - USD Acc
