isin,symbol,name
LU0290358497,XEON.DE,Xtrackers II EUR Overnight Rate Swap UCITS ETF 1C
LU0335044896,XEOD.DE,Xtrackers II EUR Overnight Rate Swap UCITS ETF 1D
IE00B3BPCH51,PJEU.DE,Invesco EuroMTS Cash 3 Months UCITS ETF
LU1190417599,LYOR.DE,Multi Units Luxembourg - Amundi Smart Overnight Return UCITS ETF Acc
FR0010510800,L8I3.DE,Amundi EUR Overnight Return UCITS ETF Acc
LU2082999306,EGV2.DE,Multi Units Luxembourg - Amundi Smart Overnight Return UCITS ETF Dist
FR0010754200,18M1.DE,Amundi Euro Government Bond 0-6 M UCITS ETF Acc
LU1681041114,FRNE.DE,Amundi Index Solutions - Amundi EUR Floating Rate Corporate Bond ESG - UCITS ETF DR - EUR (C)
IE00B3FH7618,EUN6.DE,iShares € Govt Bond 0-1yr UCITS ETF EUR (Dist)
DE000A0Q4RZ9,EXVM.DE,iShares eb.rexxGovernment Germany 0-1yr UCITS ETF (DE)
IE00BVZ6SP04,PJSR.DE,PIMCO Euro Short Maturity UCITS ETF EUR Accumulation
LU2300294316,ECR1.DE,Amundi Index Solutions - Amundi EUR Corporate Bond 0-1Y ESG UCITS ETF DR (C)
LU1686830065,LCVB.DE,Lyxor Index Fund - AMUNDI EURO CORP 0-1Y ESG - UCITS ETF
LU0613540268,XBO2.DE,Xtrackers II Italy Government Bond 0-1 Swap UCITS ETF 1C
IE00BD9MMF62,JEST.DE,JPM EUR Ultra-Short Income Active UCITS ETF – EUR (acc)
IE00B5ZR2157,PJS1.DE,PIMCO Euro Short Maturity UCITS ETF EUR Income
IE00BCRY6557,IS3M.DE,iShares € Ultrashort Bond UCITS ETF
LU2233156582,PRAB.DE,Amundi Prime Euro Government Bond 0-1Y UCITS ETF Acc
IE00BFWXDY69,FVSH.DE,Franklin Euro Short Maturity UCITS ETF
IE000STIHQB2,FVSA.DE,Franklin Euro Short Maturity UCITS ETF Acc
IE00B6YX5H87,SPPS.DE,State Street SPDR Bloomberg 0-3 Year Euro Corporate Scored UCITS ETF EUR Acc
LU2037748774,ECR3.DE,Amundi Index Solutions - Amundi EUR Corporate Bond 0-3Y ESG UCITS ETF DR (C)
IE00BF5GB717,EFRN.DE,iShares € Floating Rate Bond Advanced UCITS ETF EUR (Dist)
IE00B6X2VY59,IS0Y.DE,iShares € Corp Bond Interest Rate Hedged ESG SRI UCITS ETF EUR (Dist)
IE00BJP26D89,EUED.DE,iShares € Ultrashort Bond ESG SRI UCITS ETF EUR Inc
LU1617164998,AHYS.DE,Amundi EUR Short Term High Yield Corporate Bond ESG UCITS ETF D
IE000RHYOR04,ERNX.DE,iShares € Ultrashort Bond UCITS ETF EUR (Acc)
IE00BKWD3B81,EHBA.DE,Invesco Euro Corporate Hybrid Bond UCITS ETF Acc
IE00BKWD3966,EHBD.DE,Invesco Euro Corporate Hybrid Bond UCITS ETF Inc
DE000ETFL532,ELFF.DE,Deka Euro Corporates 0-3 Liquid UCITS ETF
DE000ETFL227,EL4W.DE,Deka Deutsche Börse EUROGOV Germany Money Market UCITS ETF
IE00BD8D5G25,EUHA.DE,PIMCO Advantage Euro Short-Term High Yield Corporate Bond Index UCITS ETF EUR Accumulation
LU2346257210,HYC.MI,Amundi Index Solution - Amundi EUR High Yield Corporate Bond ESG UCITS ETF Acc
IE00BD8D5H32,EUHI.DE,PIMCO Advantage Euro Short-Term High Yield Corporate Bond Index UCITS ETF EUR Income
LU1681040496,AHYE.DE,Amundi Index Solutions - Amundi EURO High Yield Bond ESG - UCITS ETF DR - EUR (C)
LU1812090543,LYQY.DE,Amundi Index Solution - Amundi EUR High Yield Corporate Bond ESG UCITS ETF Dist
IE00BKLC5874,EHYD.AS,iShares € High Yield Corp Bond ESG SRI UCITS ETF EUR (Dist)
IE000AK4O3W6,IE3E.DE,iShares € Corp Bond 0-3yr ESG SRI UCITS ETF EUR (Acc)
IE00BYZTVV78,QDVL.DE,iShares € Corp Bond 0-3yr ESG SRI UCITS ETF EUR (Dist)
IE0006GNB732,XZHE.DE,Xtrackers EUR High Yield Corporate Bond SRI PAB UCITS ETF 1C
IE00BC7GZW19,SYBD.DE,State Street SPDR Bloomberg 0-3 Year Euro Corporate Bond UCITS ETF
IE00BJK55C48,AYE2.DE,iShares € High Yield Corp Bond ESG SRI UCITS ETF EUR (Acc)
IE00BG0J4B71,EH1Y.DE,iShares Broad € High Yield Corp Bond UCITS ETF EUR (Dist)
LU2178481649,XZE5.DE,Xtrackers II EUR Corporate Bond Short Duration SRI PAB UCITS ETF 1C
LU1109943388,XHYA.DE,Xtrackers II EUR High Yield Corporate Bond UCITS ETF 1C
LU1109942653,XHYG.DE,Xtrackers II EUR High Yield Corporate Bond UCITS ETF 1D
IE00B66F4759,EUNW.DE,iShares € High Yield Corp Bond UCITS ETF EUR (Dist)
IE000YYE6WK5,DFEN.DE,VanEck Defense ETF A USD Acc
IE00B6YX5M31,SYBJ.DE,State Street SPDR Bloomberg Euro High Yield Bond UCITS ETF
IE00B14X4Q57,IBCA.DE,iShares € Govt Bond 1-3yr UCITS ETF EUR (Dist)
LU2244386053,ASRF.DE,BNP Paribas Easy € High Yield SRI Fossil Free
BGSLOBI02187,SLQX.DE,Expat Slovenia SBI Top UCITS ETF
IE00B4L60045,EUNT.DE,iShares € Corp Bond 1-5yr UCITS ETF EUR (Dist)
LU1048314196,UEF6.DE,UBS BBG Euro Area Liquid Corp 1-5 UCITS ETF EUR dis
IE00B3VTMJ91,CSBGE3.MI,iShares VII PLC - iShares € Govt Bond 1-3yr ETF EUR Acc
LU0925589839,XYP1.DE,Xtrackers II iBoxx Eurozone Government Bond Yield Plus 1-3 UCITS ETF 1C
LU1598691050,BTP13.MI,Amundi Italy BTP Government Bond 1-3Y UCITS ETF Dis
IE00BP9F2J32,LDCE.DE,PIMCO Advantage Euro Low Duration Corporate Bond UCITS ETF Income
LU1525418643,A4H7.DE,Amundi Index Solution - Amundi EUR Corporate Bond 1-5Y ESG UCITS ETF Acc
DE000A0F5UJ7,EXV1.DE,iShares STOXX Europe 600 Banks UCITS ETF (DE)
IE00BYMB4Q22,ITBL.MI,WisdomTree FTSE MIB Banks
LU1834983477,LBNK.DE,Multi Units Luxembourg - Amundi STOXX Europe 600 Banks UCITS ETF Acc
LU2082996112,INDA.DE,Multi Units Luxembourg - Amundi STOXX Europe 600 Banks UCITS ETF Inc
LU0290356871,DBXP.DE,Xtrackers II Eurozone Government Bond 1-3 UCITS ETF
LU1829219390,LYBK.DE,Amundi Euro Stoxx Banks UCITS ETF Acc
DE0006289309,EXX1.DE,iShares EURO STOXX Banks 30-15 UCITS ETF (DE)
IE00B5MTWD60,SC0U.DE,Invesco STOXX Europe 600 Optimised Banks UCITS ETF
LU0614173549,X03B.DE,Xtrackers II Eurozone Government Bond 1-3 UCITS ETF 1D
FR0010930644,AMEE.DE,Amundi Global Hydrogen UCITS ETF - Acc
IE00BF59RW70,JER5.DE,JPMorgan ETFs Ireland ICAV - JPM EUR 1-5 yr IG Corporate Bond Active UCITS ETF - EUR (acc)
IE00BLS09N40,3BAL.MI,WisdomTree EURO STOXX Banks 3x Daily Leveraged
NL0011683594,VDIV.DE,VanEck Morningstar Developed Markets Dividend Leaders UCITS ETF
IE00B3Q19T94,S7XE.DE,Invesco EURO STOXX Optimised Banks UCITS ETF
IE00BGJWWY63,EIB3.DE,Invesco Euro Government Bond 1-3 Year UCITS ETF
LU1681046345,X13G.MI,Amundi Index Solutions - Amundi Euro Lowest Rated IG Government Bond 1-3Y UCITS ETF-C
LU1900066033,LSMC.DE,Amundi MSCI Semiconductors ESG Screened UCITS ETF
FR0010251744,LYXIB.MC,Amundi IBEX 35 UCITS ETF
FR0010655746,AMES.DE,Amundi IBEX 35 UCITS ETF Acc
DE000A2QP372,EXA1.AS,iShares EURO STOXX Banks 30-15 UCITS ETF (DE) EUR Acc
LU1650487413,LYQ2.DE,Amundi Euro Government Bond 1-3Y UCITS ETF Acc
LU0994505336,XESD.DE,Xtrackers Spain UCITS ETF 1D
LU0592216393,XESP.DE,Xtrackers Spain UCITS ETF 1C
LU1650487926,EGV3.DE,Amundi Euro Government Bond 1-3Y UCITS ETF Dist
IE00BYVZV757,JE13.DE,JPMorgan ETFs (Ireland) ICAV - BetaBuilders EUR Govt Bond 1-3 yr UCITS ETF
IE00BF2B0L69,FLXD.DE,Franklin European Quality Dividend UCITS ETF
IE0004U3TX15,MTVR.DE,L&G Metaverse ETF USD Acc
FR0011042753,IBEXAE.XC,Amundi IBEX 35 Doble Apalancado Diario (2x) UCITS ETF
IE00BF3N7094,HIGH.L,iShares € High Yield Corp Bond UCITS ETF
LU2552296563,XY2D.DE,Xtrackers II iBoxx Eurozone Government Bond Yield Plus 1-3 UCITS ETF 2D
XS2663694680,PLT3.L,LEVERAGE SHARES PUBLIC LIMITED 
IE000F6G1DE0,IE1A.DE,iShares € Corp Bond 1-5yr UCITS ETF EUR (Acc)
IE000I8KRLL9,SEC0.DE,iShares MSCI Global Semiconductors UCITS ETF USD Acc
IE000YU9K6K2,JEDI.DE,VanEck Space Innovators UCITS ETF
IE000YDZG487,HNSC.MI,HSBC NASDAQ Global Semiconductor UCITS ETF USD
DE000ETF7029,F702.DE,Amundi Multi-Asset Portfolio Defensive UCITS ETF Dist
IE00BWTNM743,NXTG.MI,First Trust Indxx NextG UCITS ETF
IE00BMW42306,ESIF.DE,iShares MSCI Europe Financials Sector UCITS ETF
IE00BNH72088,ZPRC.DE,State Street SPDR FTSE Global Convertible Bond UCITS ETF
IE00B87RLX93,IS3B.DE,iShares € Corp Bond Financials UCITS ETF EUR (Dist)
IE00BG0SKF03,5MVL.DE,iShares Edge MSCI EM Value Factor UCITS ETF USD (Acc)
IE00BKWQ0G16,SPYZ.DE,State Street SPDR MSCI Europe Financials UCITS ETF
LU1805389258,UIQL.DE,UBS Core BBG Euro Area Liquid Corp UCITS ETF EUR dis
IE00B4L5ZY03,EUNS.DE,iShares € Corp Bond ex-Financials 1-5yr ESG SRI UCITS ETF EUR (Dist)
XS2435550947,3LCR.MI,GraniteShares 3x Long UniCredit Daily ETP
LU0292096186,XGSD.DE,Xtrackers Stoxx Global Select Dividend 100 Swap UCITS ETF 1D
IE00BZ4BMM98,EHDV.DE,Invesco EURO STOXX High Dividend Low Volatility UCITS ETF
DE0002635299,EXSH.DE,iShares STOXX Europe Select Dividend 30 UCITS ETF (DE)
DE000A0F5UH1,ISPA.DE,iShares STOXX Global Select Dividend 100 UCITS ETF (DE)
LU0659579063,XB4A.DE,Xtrackers ATX UCITS ETF 1C
LU0274212538,DBXI.DE,Xtrackers FTSE MIB UCITS ETF 1D
IE00BZ0XVG69,WTIG.DE,WisdomTree AT1 CoCo Bond UCITS ETF - USD Acc
FR0013416716,GOLD.MI,Amundi Physical Gold ETC C
IE00BDT6FP91,SPF1.DE,State Street SPDR FTSE Global Convertible Bond EUR Hdg UCITS ETF (Acc)
IE00B53L4X51,SXRY.DE,iShares VII PLC - iShares FTSE MIB ETF EUR Acc
IE00B1XNH568,IMIB.MI,iShares FTSE MIB UCITS ETF EUR (Dist)
IE00BZ0XVF52,WTDI.DE,WisdomTree AT1 CoCo Bond UCITS ETF - USD
LU0468897110,D5BC.DE,Xtrackers II Germany Government Bond 1-3 UCITS ETF
DE000A0S9GB0,4GLD.DE,DT.BOERSE COM. XETRA-GOLD
LU2533810862,BJLG.DE,BNP PARIBAS EASY - JPM Tilted EMU Government Bond IG 1-3Y UCITS ETF CAPITALISATION
IE00BSKRK281,IS06.DE,iShares € Corp Bond BBB-BB UCITS ETF EUR (Dist)
LU1812092168,SELD.DE,Amundi Stoxx Europe Select Dividend 30 UCITS ETF D
DE000A0D8Q23,EXXX.DE,iShares ATX UCITS ETF (DE)
IE00BP3QZB59,IS3S.DE,iShares Edge MSCI World Value Factor UCITS ETF USD (Acc)
IE00BL25JM42,XDEV.DE,Xtrackers MSCI World Value UCITS ETF 1C
FR0010010827,MIB.PA,Amundi FTSE MIB UCITS ETF
DE000ETFL185,EL4S.DE,Deka Deutsche Börse EUROGOV Germany 1-3 UCITS ETF
IE00BDT6FS23,GCVC.SW,State Street SPDR FTSE Global Convertible Bond CHF Hdg UCITS ETF (Acc)
IE000Q2P3ZQ3,IGLG.L,iShares Physical Gold GBP Hedged ETC
LU0659579147,XBAK.DE,Xtrackers MSCI Pakistan Swap UCITS ETF 1C
IE00B4ND3602,SGLN.MI,iShares Physical Gold ETC
DE000A2T0VU5,XGDU.DE,XTrackers ETC PLC             E
DE000A1E0HR8,XAD5.MI,Xtrackers Physical Gold ETC (EUR)
DE000A2UDH48,XGDG.L,Xtrackers IE Physical Gold GBP Hedged ETC Securities
LU0292103651,XS7R.DE,Xtrackers MSCI Europe Financials Screened UCITS ETF 1C
IE000MUAJIF4,ECMD.DE,InvescoM2-EUR CB ESG SD Mu ETFR
IE00BYPHT736,XDEP.DE,Xtrackers iBoxx EUR Corporate Bond Yield Plus UCITS ETF 1D
IE000PA766T7,ECMS.DE,Invesco EUR Corporate Bond ESG Short Duration Multi-Factor UCITS ETF EUR Acc
IE00B579F325,SGLD.MI,Invesco Physical Gold ETC
JE00B7VG2M16,GBSP.L,WisdomTree Physical Gold - GBP Daily Hedged
GB00B68FL050,XGLS.L,Xtrackers Physical Gold GBP Hedged ETC
IE00BMQ5Y557,TCRS.DE,Janus Henderson HMT Global IG Credit Curve Steepener Core UCITS ETF Acc
IE00BDT6FT30,GCVG.L,State Street SPDR FTSE Global Convertible Bond GBP Hdg UCITS ETF (Inc)
IE00BGV5VN51,XAIX.DE,Xtrackers Artificial Intelligence & Big Data UCITS ETF 1C
JE00B588CD74,SGBS.MI,WisdomTree Physical Swiss Gold
JE00BN2CJ301,WGLD.MI,WisdomTree Core Physical Gold USD ETC
XS2183935605,SGLS.L,Invesco Physical Gold ETC GBP Hedged
LU1130155606,CAHEUA.MI,UBS MSCI Canada UCITS ETF hEUR acc
IE00B3Y8D011,XS7W.DE,Xtrackers Portfolio Income UCITS ETF 1D
DE0002635281,EXSG.DE,iShares EURO STOXX Select Dividend 30 UCITS ETF (DE)
IE00BFYTYS33,IWVU.L,iShares Edge MSCI World Value Factor UCITS ETF USD (Dist)
IE000CM02H85,FLXT.DE,Franklin FTSE Taiwan UCITS ETF
IE000UX5WPU4,XYPL.DE,Xtrackers iBoxx EUR Corporate Bond Yield Plus UCITS ETF 1C
BGHUBUX01189,HUBE.DE,Expat Hungary BUX UCITS ETF
IE00B0M62S72,IQQA.DE,iShares Euro Dividend UCITS ETF EUR Dist
LU0397221945,XQUI.DE,Xtrackers Portfolio UCITS ETF 1C
DE000ETFL078,EL4G.DE,Deka EURO STOXX Select Dividend 30 UCITS ETF
LU1215415214,AHYE.DE,Amundi Index Solutions - Amundi EURO High Yield Bond ESG - UCITS ETF DR - EUR (C)
IE00BDT6FR16,SPF2.DE,State Street SPDR FTSE Global Convertible Bond USD Hdg UCITS ETF (Inc)
JE00B1VS3770,PHAU.MI,WisdomTree Physical Gold
IE0009JOT9U1,IGLD.DE,iShares Physical Metals PLC   O
LU1829219556,LYS4.DE,Amundi Euro Highest Rated Macro-Weighted Government Bond 1-3Y UCITS ETF Acc
IE00BYTH6121,FGBL.PA,First Trust Global Equity Income UCITS ETF Class A USD
LU1603790731,IQEC.MI,IndexIQ Factors Sustainable Corporate Euro Bond UCITS ETF Dis
JE00B8DFY052,GBSE.MI,WisdomTree Physical Gold - EUR Daily Hedged
DE000EWG0LD1,EWGT.DE,EUWAX Gold Traceable ETC
FR0010405431,LYMH.DE,Amundi MSCI Greece UCITS ETF
IE00BKT6BH25,IX5A.AS,iShares € Corp Bond ex-Financials 1-5yr ESG SRI UCITS ETF EUR (Acc)
DE000A2QP380,IDVA.AS,iShares EURO STOXX Select Dividend 30 UCITS ETF (DE) EUR Acc
LU2446383338,ASRX.DE,BNP Paribas Easy € Corp Bond SRI PAB 3-5Y
XS2427354985,WMIB.MI,WisdomTree FTSE MIB
DE000A1EK0G3,XAD1.MI,Xtrackers Physical Gold EUR Hedged ETC
DE000A2T5DZ1,XGDE.MI,Xtrackers IE Physical Gold EUR Hedged ETC Securities 5
IE000KYX7IP4,WELK.DE,Amundi ETF ICAV - Amundi S&P World Financials Screened UCITS ETF Acc
IE000M7V94E1,NUKL.DE,VanEck Uranium and Nuclear Technologies UCITS ETF
GB00B5840F36,XAD5.MI,Xtrackers Physical Gold ETC (EUR)
IE00BM67HR47,XWTS.DE,Xtrackers MSCI World Communication Services UCITS ETF 1C
LU1681037518,FMI.MI,Amundi Index Solutions - Amundi ITALY MIB ESG UCITS ETF DR - EUR C
IE00B3S1J086,HTWN.MI,HSBC MSCI Taiwan Capped UCITS ETF
IE000ENYES77,WELY.DE,Amundi ETF ICAV - Amundi S&P World Financials Screened UCITS ETF Dist
LU2008761053,ASR5.DE,BNP Paribas Easy € Corp Bond SRI PAB 3-5Y
LU1900066462,LEER.DE,Amundi MSCI Eastern Europe Ex Russia UCITS ETF
DE0006289473,EXHB.DE,iShares eb.rexx Government Germany 1.5-2.5yr UCITS ETF (DE)
IE0008YN55P8,IQSD.DE,InvescoM2-IQS Global Eq ETF   R
LU1130155432,CAHCHA.SW,UBS MSCI Canada UCITS ETF hCHF acc
LU1615090864,EDEU.DE,BNP Paribas Easy Dividend Europe UCITS ETF Capitalisation
BGCZPX003174,CZX.DE,Expat Czech PX UCITS ETF
LU1681042518,VCEU.MI,Amundi Index Solutions - Amundi MSCI Europe Value Factor UCITS ETF-C
IE00BJQRDP39,IQSE.DE,Invesco Global Active ESG Equity UCITS ETF EUR PfHedged Acc
LU0292109187,DBX5.DE,Xtrackers MSCI Taiwan UCITS ETF 1C
IE00BDDRF478,IU5C.DE,iShares V PLC - iShares S&P 500 Communication Sector UCITS ETF
IE00B23LNQ02,PSWD.DE,Invesco RAFI All-World Fundamental Value UCITS ETF
LU0533032859,LYPD.DE,Amundi MSCI World Financials UCITS ETF EUR Acc
IE00BYTRRG40,WTEL.MI,State Street SPDR MSCI World Communication Services UCITS ETF USD Acc
FR0010446658,LEVMIB.MI,Amundi FTSE MIB Daily (2x) Leveraged UCITS ETF Dist
IE00BFNNN236,WTEB.DE,WisdomTree AT1 CoCo Bond UCITS ETF - EUR Hedged
LU1109939865,XHY1.DE,Xtrackers II Rolling Target Maturity Sept 2027 EUR High Yield UCITS ETF 1D
IE00BF5DXP42,BLOK.DE,First Trust Indxx Innovative Transaction & Process UCITS ETF
GB00B00FHZ82,GBS.MI,Gold Bullion Securities
IE00BJQRDN15,IQSA.DE,Invesco Global Active ESG Equity UCITS ETF USD Acc
IE00BJ5JP436,WCMS.AS,iShares MSCI World Communication Services Sector Advanced UCITS ETF USD Inc
NL0009272772,NTM.AS,VanEck Multi-Asset Balanced Allocation UCITS ETF
IE00BFNNN459,COGO.L,WisdomTree AT1 CoCo Bond UCITS ETF - GBP Hedged
XS2820604770,3NVD.MI,Leverage Shares 3x NVIDIA ETC
IE00BD842Y21,DINC.L,FIRST TRUST GLOBAL FUNDS PUBLIC
BGCROEX03189,ECDC.DE,Expat Croatia Crobex UCITS ETF
IE00BMC38736,VVSM.DE,VanEck Semiconductor UCITS ETF
LU0292095535,DXSA.DE,Xtrackers Euro Stoxx Quality Dividend UCITS ETF
FR0007075494,MGT.MI,Amundi DJ Global Titans 50 UCITS ETF Dist
IE00BFWFPX50,ZPDK.DE,State Street SPDR S&P U.S. Communication Services Select Sector UCITS ETF
IE000NVVIF88,H41E.DE,HSBC MSCI Emerging Markets Value Screened UCITS ETF USD Acc
LU0950669845,AW1T.DE,UBS MSCI EMU Value UCITS ETF EUR acc
LU1130155861,CAHUSA.SW,UBS MSCI Canada UCITS ETF hUSD acc
IE00023EZQ82,CBUN.DE,iShares Digital Entertainment and Education UCITS ETF
DE0006289382,EXI2.DE,iShares Dow Jones Global Titans 50 UCITS ETF (DE)
IE00BNC1G707,XUCM.DE,Xtrackers MSCI USA Communication Services UCITS ETF 1D
IE00BMVB5P51,V60A.DE,Vanguard LifeStrategy 60% Equity UCITS ETF (EUR) Accumulating
IE00BMYDM919,LGGE.DE,L&G Europe ex-UK Quality Dividends Equal Weight ETF EUR Dis
IE00BMVB5Q68,V60D.DE,Vanguard LifeStrategy 60% Equity UCITS ETF (EUR) Distributing
IE000VXC51U5,XMAE.DE,Xtrackers MSCI AC World Screened UCITS ETF 2C - EUR Hedged
IE00BM67HL84,XDWF.DE,Xtrackers MSCI World Financials UCITS ETF 1C
IE00BJ5JP097,WFNS.AS,iShares MSCI World Financials Sector Advanced UCITS ETF USD Inc
LU2009202107,EMXC.DE,Amundi MSCI Emerging Ex China UCITS ETF Acc
IE00BMVB5R75,V80A.DE,Vanguard LifeStrategy 80% Equity UCITS ETF (EUR) Accumulating
FR0011660927,WLDH.MI,Amundi MSCI World Swap II UCITS ETF EUR Hedged Dist
DE000ETF7011,F701.DE,Amundi Multi-Asset Portfolio UCITS ETF Dist
IE00BMVB5S82,V80D.DE,Vanguard LifeStrategy 80% Equity UCITS ETF (EUR) Distributing
IE00B652H904,EUNY.DE,iShares EM Dividend UCITS ETF USD (Dist)
IE00B7KMNP07,UBUD.DE,UBS Solactive Global Pure Gold Miners UCITS ETF USD dis
IE00B42YS929,IGWD.L,iShares MSCI World GBP Hedged UCITS ETF (Acc)
IE000H1H16W5,CBUI.DE,iShares MSCI World Value Factor Advaced UCITS ETF USD (Acc)
LU0486851024,D5BL.DE,Xtrackers MSCI Europe Value UCITS ETF 1C
LU1598690169,LGWS.DE,Amundi MSCI EMU Value Factor ETF Distribution
NL0009272764,DTM.AS,VanEck Multi-Asset Conservative Allocation UCITS ETF
IE00018LB0D8,WF1E.DE,Invesco Markets II plc - Invesco S&P World Financials ESG UCITS ETF Acc
IE00B0M63623,IQQT.DE,iShares MSCI Taiwan UCITS ETF USD (Dist)
IE00BDQZN113,AWESGW.SW,UBS MSCI ACWI Universal UCITS ETF hUSD acc
DE000ETFL474,ELFB.DE,Deka Euro Prime ESG UCITS ETF
IE00BYTRR970,WFIN.MI,State Street SPDR MSCI World Financials UCITS ETF USD Acc
IE00B8X9NY41,FTGE.DE,First Trust Eurozone AlphaDEX UCITS ETF Class A Shares
DE000ETFL128,EL4L.DE,Deka iBoxx EUR Liquid Sovereign Diversified 1-3 UCITS ETF
IE00BQN1K901,CEMS.DE,iShares Edge MSCI Europe Value Factor UCITS ETF EUR (Acc)
IE00BDQZMX67,AWESG.MI,UBS MSCI ACWI Universal UCITS ETF USD dis
IE00BYM11J43,ACWIU.SW,UBS MSCI ACWI SF UCITS ETF hUSD acc
IE00BYM11K57,ACWIE.MI,UBS MSCI ACWI SF UCITS ETF hEUR acc
IE00BFZPF439,XAT1.DE,Invesco USD AT1 CoCo Bond UCITS ETF EUR Hedged Dist
IE00BG13YH41,IEDL.L,iShares Edge MSCI Europe Value Factor UCITS ETF EUR (Dist)
IE00BYVDRC61,ACUUKD.SW,UBS MSCI ACWI SF UCITS ETF hUSD Ukdis
IE00BYQCZL35,DXJD.SW,WisdomTree Japan Equity UCITS ETF - CHF Hedged Acc
IE00B441G979,IBCH.DE,iShares MSCI World EUR Hedged UCITS ETF (Acc)
IE00BYM11H29,ACWIA.MI,UBS MSCI ACWI SF UCITS ETF USD acc
IE00BDQZN774,AWESGS.SW,UBS MSCI ACWI Universal UCITS ETF hCHF acc
NL0010408704,TSWE.DE,VanEck World Equal Weight Screened UCITS ETF
IE00BKZGB098,HWWD.L,HSBC Multi Factor Worldwide Equity UCITS ETF
IE000EFHIFG3,WELX.DE,Amundi ETF ICAV - Amundi S&P World Communication Services Screened UCITS ETF Acc
IE00BJXFZ989,ACWUKD.SW,UBS MSCI ACWI SF UCITS ETF USD Ukdis
IE00BMH5Y327,V9N.DE,Global X Data Center REITS & Digital Infrastructure UCITS ETF USD Acc
IE00BMVB5M21,V40A.DE,Vanguard LifeStrategy 40% Equity UCITS ETF (EUR) Accumulating
IE00BQZJBX31,WTEE.DE,WisdomTree Europe Equity Income UCITS ETF
IE00BDQZN667,AWESGT.SW,UBS MSCI ACWI Universal UCITS ETF hCHF dis
IE00BDF16007,EEIA.MI,WisdomTree Europe Equity Income UCITS ETF Acc
IE00BMVB5N38,V40D.DE,Vanguard LifeStrategy 40% Equity UCITS ETF (EUR) Distributing
IE000ANYHV73,WELR.DE,Amundi ETF ICAV - Amundi S&P World Communication Services Screened UCITS ETF Dist
IE00B8NB3063,3ITL.MI,WisdomTree FTSE MIB 3x Daily Leveraged
IE00B3CNHG25,ETLX.DE,L&G Gold Mining UCITS ETF
IE00BZ0PKV06,IBC0.DE,iShares STOXX Europe Equity Multifactor UCITS ETF EUR (Acc)
IE00BG13YL86,IFSD.L,iShares STOXX Europe Equity Multifactor UCITS ETF EUR (Dist)
IE00BZ2GTT26,ACCUKD.SW,UBS MSCI ACWI SF UCITS ETF hCHF Ukdis
IE00BSPLC306,ZPRW.DE,State Street SPDR MSCI Europe Value UCITS ETF EUR Acc
NL0009272780,TOF.AS,VanEck Multi-Asset Growth Allocation UCITS ETF
IE00BYQCZF74,DXJP.L,WisdomTree Japan Equity UCITS ETF - GBP Hedged
IE00B23D8X81,6PSC.DE,Invesco RAFI Europe Fundamental Value UCITS ETF
IE00BGHQ0G80,XMAW.DE,Xtrackers MSCI AC World Screened UCITS ETF 1C
LU1829220216,LYY0.DE,Amundi MSCI All Country World UCITS ETF EUR Acc
IE00BYM11L64,ACWIS.SW,UBS MSCI ACWI SF UCITS ETF hCHF acc
IE00BG7PP820,XLCS.MI,Invesco Communications S&P US Select Sector UCITS ETF USD Acc
IE00B8GKDB10,VGWD.DE,Vanguard FTSE All-World High Dividend Yield UCITS ETF USD Distributing
LU0478205379,D5BG.DE,Xtrackers II EUR Corporate Bond UCITS ETF 1C
IE00BZ163G84,VECP.DE,Vanguard EUR Corporate Bond UCITS ETF
IE00BGYWT403,VECA.DE,Vanguard EUR Corporate Bond UCITS ETF EUR Accumulation
IE00BF59RX87,JREB.DE,JPMorgan ETFs Ireland ICAV - JPM EUR IG Corporate Bond Active UCITS ETF - EUR (acc)
LU2089238625,PRAC.DE,Amundi Core Eur Corporate Bond UCITS ETF DR - EUR (C)
DE000A0H0744,EXXW.DE,iShares Dow Jones Asia Pacific Select Dividend 50 UCITS ETF (DE)
IE00BJXRT813,WVAL.L,State Street SPDR MSCI World Value UCITS ETF
IE00BLSNMW37,BBCK.DE,Invesco Global Buyback Achievers UCITS ETF
IE00BYQCZJ13,WTIF.DE,WisdomTree Japan Equity UCITS ETF - EUR Hedged Acc
LU2244386137,ASRG.DE,BNP Paribas Easy € High Yield SRI Fossil Free
IE00B3F81R35,EUN5.DE,iShares Core € Corp Bond UCITS ETF EUR (Dist)
IE00B6R52259,IUSQ.DE,iShares MSCI ACWI UCITS ETF USD Acc
IE000J80JTL1,GRID.DE,First Trust Nasdaq Clean Edge Smart Grid Infrastructure UCITS ETF
LU0832436512,LGQI.DE,Amundi Global Equity Quality Income UCITS ETF Dist
IE00BK5BQT80,VWCE.DE,Vanguard FTSE All-World UCITS ETF USD Accumulation
IE00B3RBWM25,VGWL.DE,Vanguard FTSE All-World UCITS ETF
IE00BF1B7389,SPP1.DE,State Street SPDR MSCI All Country World EUR Hdg UCITS ETF (Acc)
FR0014003IY1,WLDC.MI,Amundi MSCI World Swap II UCITS ETF Acc
DE000A0H08K7,EXH5.DE,iShares STOXX Europe 600 Insurance UCITS ETF (DE)
IE00BYSX4739,FYEQ.DE,Fidelity Emerging Markets Quality Income UCITS ETF USD Inc
GB00B15KXX56,SBUL.MI,WisdomTree Gold 1x Daily Short ETP Securities
IE00BF1B7272,SPP2.DE,State Street SPDR MSCI All Country World UCITS ETF USD Acc
DE000ETF7037,F703.DE,Amundi Multi-Asset Portfolio Offensive UCITS ETF Dist
IE00BYSX4846,FYEM.DE,Fidelity Emerging Markets Quality Income UCITS ETF USD Acc
LU1681039308,JP40.DE,Amundi Index Solutions - Amundi JPX-Nikkei 400
LU1923163676,AFRHG.PA,Amundi Index Solutions - Amundi Floating Rate EURO Corporate 1-3 UCITS ETF-C GBP Hedged
XS2115336336,RMAU.MI,Royal Mint Responsibly Sourced Physical Gold ETC
LU1931975079,PR1C.DE,Amundi Core EUR Corporate Bond UCITS ETF Dist
LU1834987973,LIRU.DE,Multi Units Luxembourg - Amundi STOXX Europe 600 Insurance UCITS ETF Acc
LU0478205965,XEC1.DE,Xtrackers II EUR Corporate Bond UCITS ETF (DR) 1D
IE00BLLZQS08,MODR.DE,iShares Moderate Portfolio UCITS ETF EUR (Acc)
LU2082997946,EGV1.DE,Multi Units Luxembourg - Amundi STOXX Europe 600 Insurance UCITS ETF Inc
LU1681047665,JPHC.PA,Amundi Index Solutions - Amundi JPX-Nikkei 400 UCITS ETF-C CHF Hedged
XS2399365043,TSM3.L,LEVERAGE SHARES PUBLIC LIMITED 
IE00BK5BZX59,3GOO.MI,Leverage Shares 3x Alphabet ETC
IE00B44Z5B48,SPYY.DE,State Street SPDR MSCI All Country World UCITS ETF
FR0010315770,LYYA.DE,Amundi MSCI World Swap II UCITS ETF Dist
LU1437018168,A4H8.DE,Amundi Index Solutions - Amundi EUR Corporate Bond ESG UCITS ETF DR (C)
LU0484968812,XB4F.DE,Xtrackers II EUR Corporate Bond SRI PAB UCITS ETF 1D
LU1737653987,DECR.DE,Amundi Index Solutions - Amundi EUR Corporate Bond ESG UCITS ETF DR (D)
LU0950672807,CANA.MI,UBS MSCI Canada UCITS ETF CAD acc
LU1681039647,TCC4.DE,Amundi Index Solutions - Amundi EUR Corporate Bond ESG UCITS ETF 2 DR - EUR (C)
IE00B5MTXJ97,SC0Y.DE,Invesco STOXX Europe 600 Optimised Insurance UCITS ETF
LU1169825954,UE24.AS,UBS MSCI Singapore UCITS ETF SGD dis
JE00B4RKQV36,EBUL.MI,WisdomTree Gold - EUR Daily Hedged
IE00BK5BQV03,VGVF.DE,Vanguard FTSE Developed World UCITS ETF USD Accumulation
IE00BFZPF322,AT1.MI,Invesco USD AT1 CoCo Bond UCITS ETF Acc
IE00BM67HV82,XDWI.DE,Xtrackers MSCI World Industrials UCITS ETF 1C
LU1829220133,ACWL.L,Amundi MSCI All Country World UCITS ETF USD Acc
IE00B3YLTY66,SPYI.DE,State Street SPDR MSCI All Country World Investable Market UCITS ETF
DE000ETFL508,ELFW.DE,Deka MSCI World UCITS ETF
IE00BKX55T58,VGVE.DE,Vanguard FTSE Developed World UCITS ETF USD Distributing
LU2008760592,ASR3.DE,BNP Paribas Easy € Corp Bond SRI PAB 1-3Y UCITS ETF Inc
IE00B3VSSL01,XLKS.MI,Invesco Technology S&P US Select Sector UCITS ETF
IE00B0M63060,IQQD.DE,iShares UK Dividend UCITS ETF GBP (Dist)
LU0446734872,UIM9.DE,UBS MSCI Canada UCITS ETF CAD dis
LU1681041973,EHF1.DE,Amundi Index Solutions - Amundi MSCI Europe High Dividend Factor UCITS ETF-C
IE00BYTRRC02,WIND.MI,State Street SPDR MSCI World Industrials UCITS ETF USD Acc
IE00BGV5VR99,XMOV.DE,Xtrackers Future Mobility UCITS ETF 1C
LU1681039134,JPHE.PA,Amundi Index Solutions - Amundi JPX-Nikkei 400 UCITS ETF-C EUR Hedged
IE00BG0TQB18,AT1D.MI,Invesco USD AT1 CoCo Bond UCITS ETF USD Dist
LU1681038086,TPHG.PA,Amundi Index Solutions - Amundi Japan Topix UCITS ETF-C GBP Hedged
LU1681038169,TPHC.PA,Amundi Index Solutions - Amundi Japan Topix UCITS ETF-C CHF Hedged
LU0959211326,SPHC.MI,Amundi Core S&P 500 Swap UCITS ETF EUR Hedged Acc
LU1484799843,4UBF.DE,UBS BBG MSCI Euro Area Liquid Corp Sustainable UCITS ETF EUR acc
IE00B3T9LM79,SYBC.DE,State Street SPDR Bloomberg Euro Corporate Bond UCITS ETF
IE00B14X4T88,IQQX.DE,iShares Asia Pacific Dividend UCITS ETF USD (Dist)
LU0484968903,XB4D.DE,Xtrackers II EUR Corporate Bond SRI PAB UCITS ETF 1C
IE00BF51K249,PSFE.DE,Invesco EUR IG Corporate Bond ESG Climate Transition UCITS ETF
IE00BKPSFC54,WQDA.AS,iShares MSCI World Quality Dividend Advanced UCITS ETF USD Acc
LU1169821888,JPNCHF.SW,UBS Core MSCI Japan UCITS ETF hCHF acc
LU1875395870,XDJE.DE,Xtrackers Nikkei 225 UCITS ETF 2D EUR Hedged
IE00BVGC6645,NS4E.DE,Invesco JPX-Nikkei 400 UCITS ETF (EUR Hdg)
LU1681043599,AMEW.DE,Amundi Index Solutions - Amundi MSCI World Swap UCITS ETF EUR Acc
IE00BMG6Z448,84X0.DE,iShares MSCI EM ex China UCITS ETF USD Acc
IE00BQQP9G91,G2XJ.DE,VanEck Junior Gold Miners UCITS ETF
LU1484799769,UIMC.DE,UBS BBG MSCI Euro Area Liquid Corp Sustainable UCITS ETF EUR dis
